{
  "$schema": "https://json-schema.org/draft/2020-12/schema",
  "$id": "https://mariner.internal/schema/findings.schema.json",
  "title": "AES-GCM media decryption findings",
  "type": "array",
  "items": {
    "type": "object",
    "additionalProperties": false,
    "required": [
      "frame_id",
      "label",
      "gif_index",
      "key_version",
      "key_source",
      "nonce_hex",
      "nonce_source",
      "auth_ok",
      "plaintext_sha256",
      "reason_code"
    ],
    "properties": {
      "frame_id": {
        "type": "string",
        "pattern": "^frm-[0-9]{3}$"
      },
      "label": {
        "type": "string"
      },
      "gif_index": {
        "type": "integer",
        "minimum": 0
      },
      "key_version": {
        "type": "integer",
        "minimum": 1
      },
      "key_source": {
        "type": "string",
        "enum": [
          "rotation_replacement",
          "latest_assigned"
        ]
      },
      "nonce_hex": {
        "type": "string",
        "pattern": "^[0-9A-F]{24}$"
      },
      "nonce_source": {
        "type": "string",
        "enum": [
          "derived",
          "override"
        ]
      },
      "auth_ok": {
        "type": "boolean"
      },
      "plaintext_sha256": {
        "type": [
          "string",
          "null"
        ]
      },
      "reason_code": {
        "type": "string",
        "enum": [
          "authenticated",
          "auth_failed"
        ]
      }
    },
    "allOf": [
      {
        "if": {
          "properties": {
            "auth_ok": {
              "const": true
            }
          },
          "required": [
            "auth_ok"
          ]
        },
        "then": {
          "properties": {
            "plaintext_sha256": {
              "type": "string",
              "pattern": "^[0-9a-f]{64}$"
            },
            "reason_code": {
              "const": "authenticated"
            }
          }
        },
        "else": {
          "properties": {
            "plaintext_sha256": {
              "type": "null"
            },
            "reason_code": {
              "const": "auth_failed"
            }
          }
        }
      }
    ]
  }
}
