[
  {
    "frame_id": "frm-001",
    "label": "alpha-channel",
    "gif_index": 0,
    "key_version": 2,
    "key_source": "latest_assigned",
    "nonce_hex": "89099EF96B8D2C894091EEDF",
    "nonce_source": "derived",
    "auth_ok": true,
    "plaintext_sha256": "579fec66d3d61cdb196db5026a437df67ea337ff5100b21c5ace558b012e2fe5",
    "reason_code": "authenticated"
  },
  {
    "frame_id": "frm-002",
    "label": "bravo-channel",
    "gif_index": 1,
    "key_version": 3,
    "key_source": "rotation_replacement",
    "nonce_hex": "267A3B911F8B35439968F9DF",
    "nonce_source": "derived",
    "auth_ok": true,
    "plaintext_sha256": "f9e276e3f7ec7ad8ba551b42a1d547a13d9abf408a7341cc930dc28e0aff3072",
    "reason_code": "authenticated"
  },
  {
    "frame_id": "frm-003",
    "label": "charlie-channel",
    "gif_index": 2,
    "key_version": 2,
    "key_source": "latest_assigned",
    "nonce_hex": "A7C3E91B4D2F8065E1B9C0A3",
    "nonce_source": "override",
    "auth_ok": true,
    "plaintext_sha256": "31247b0578f3a923d6058bc1b06dde8cebd00c1e9544e0562a16ef579a955cfa",
    "reason_code": "authenticated"
  },
  {
    "frame_id": "frm-004",
    "label": "delta-channel",
    "gif_index": 4,
    "key_version": 4,
    "key_source": "rotation_replacement",
    "nonce_hex": "806586F8E145538DC6340B64",
    "nonce_source": "derived",
    "auth_ok": true,
    "plaintext_sha256": "8a3e30cd883ea0cdf5cc857b5740bc59ec605a5339f02cff07b777e4a69939ba",
    "reason_code": "authenticated"
  },
  {
    "frame_id": "frm-005",
    "label": "echo-channel",
    "gif_index": 5,
    "key_version": 2,
    "key_source": "rotation_replacement",
    "nonce_hex": "51CF31D43093FBEB42AB08B3",
    "nonce_source": "derived",
    "auth_ok": true,
    "plaintext_sha256": "493de23f28729cf997cfd98102621fc292cdad2fa63c8a3e8cfa3de5aef779e2",
    "reason_code": "authenticated"
  },
  {
    "frame_id": "frm-006",
    "label": "foxtrot-channel",
    "gif_index": 6,
    "key_version": 2,
    "key_source": "latest_assigned",
    "nonce_hex": "3F08D5621CA4790BEE17F2D8",
    "nonce_source": "override",
    "auth_ok": true,
    "plaintext_sha256": "99f1a0bd29bd0a13c23cb502685953c84ebdfc756e9e7b278857a3347ed9f2d9",
    "reason_code": "authenticated"
  },
  {
    "frame_id": "frm-007",
    "label": "golf-channel",
    "gif_index": 7,
    "key_version": 2,
    "key_source": "latest_assigned",
    "nonce_hex": "B4E19A7305C2D8F61E0A4B9C",
    "nonce_source": "override",
    "auth_ok": true,
    "plaintext_sha256": "f63ac17b8ec39d3584c2773cf854d3832b35e0f206efb05bddbb6fef56218969",
    "reason_code": "authenticated"
  },
  {
    "frame_id": "frm-008",
    "label": "hotel-channel",
    "gif_index": 8,
    "key_version": 2,
    "key_source": "latest_assigned",
    "nonce_hex": "C1D2E3F4029384758690A1B2",
    "nonce_source": "override",
    "auth_ok": true,
    "plaintext_sha256": "a61fecb2d01de4b3df85949adbcb8b9c37c3bfff66a3084362c428ffa5f05962",
    "reason_code": "authenticated"
  },
  {
    "frame_id": "frm-009",
    "label": "india-channel",
    "gif_index": 9,
    "key_version": 5,
    "key_source": "rotation_replacement",
    "nonce_hex": "7F5CBF36DACF3B317F658653",
    "nonce_source": "derived",
    "auth_ok": true,
    "plaintext_sha256": "1a54b6a1d0c3f65593a7d0ab0f5c9b5449f92691a558f8b34ca68f68d91e3e28",
    "reason_code": "authenticated"
  },
  {
    "frame_id": "frm-010",
    "label": "juliet-channel",
    "gif_index": 10,
    "key_version": 2,
    "key_source": "latest_assigned",
    "nonce_hex": "0A1B2C3D4E5F60718293A4B5",
    "nonce_source": "override",
    "auth_ok": true,
    "plaintext_sha256": "7f615c12fdbd17b79f517a57fbb5345617d613c38f518e29f112349c92764c3c",
    "reason_code": "authenticated"
  },
  {
    "frame_id": "frm-011",
    "label": "kilo-channel",
    "gif_index": 11,
    "key_version": 4,
    "key_source": "rotation_replacement",
    "nonce_hex": "3CC7357FDB1401698C21BD64",
    "nonce_source": "derived",
    "auth_ok": true,
    "plaintext_sha256": "5a8d0bdccd45b43319bf5c54ad9000501af4119b63f17926bc8f2bb4112a94fb",
    "reason_code": "authenticated"
  },
  {
    "frame_id": "frm-012",
    "label": "lima-channel",
    "gif_index": 12,
    "key_version": 4,
    "key_source": "rotation_replacement",
    "nonce_hex": "1034F5A8203678722A3BD141",
    "nonce_source": "derived",
    "auth_ok": true,
    "plaintext_sha256": "73c26bf866446401365f17a0f015bf36e55731b572cc9e9b1029977db502018d",
    "reason_code": "authenticated"
  },
  {
    "frame_id": "frm-013",
    "label": "mike-channel",
    "gif_index": 13,
    "key_version": 4,
    "key_source": "rotation_replacement",
    "nonce_hex": "D56D3AA88313478899DDF46B",
    "nonce_source": "derived",
    "auth_ok": true,
    "plaintext_sha256": "6a21dce8e2b52b7be017388b8a54bd98e94f5f3f6851c66453ebc5e5b8586f05",
    "reason_code": "authenticated"
  },
  {
    "frame_id": "frm-014",
    "label": "november-channel",
    "gif_index": 14,
    "key_version": 4,
    "key_source": "rotation_replacement",
    "nonce_hex": "ABCDEF0123456789ABCDEF01",
    "nonce_source": "override",
    "auth_ok": true,
    "plaintext_sha256": "5c7e4f07eac194fe16e7eeee3e0ba3a336fc040cbd1b0502f34c0f4dab836e7a",
    "reason_code": "authenticated"
  },
  {
    "frame_id": "frm-015",
    "label": "oscar-channel",
    "gif_index": 15,
    "key_version": 4,
    "key_source": "rotation_replacement",
    "nonce_hex": "13579BDF2468ACE024681ACE",
    "nonce_source": "override",
    "auth_ok": true,
    "plaintext_sha256": "186e244e80c451ed3f512b02a868a905b5ef846d03b8022261ecfcc3e73cf9ea",
    "reason_code": "authenticated"
  },
  {
    "frame_id": "frm-016",
    "label": "papa-channel",
    "gif_index": 16,
    "key_version": 2,
    "key_source": "latest_assigned",
    "nonce_hex": "33445566778899AABBCCDDEE",
    "nonce_source": "override",
    "auth_ok": true,
    "plaintext_sha256": "dd74981e54c5cfe781adf217727a9277f4af86d22456e89e27cdfcbcf24fa86e",
    "reason_code": "authenticated"
  },
  {
    "frame_id": "frm-017",
    "label": "quebec-channel",
    "gif_index": 17,
    "key_version": 4,
    "key_source": "rotation_replacement",
    "nonce_hex": "66778899AABBCCDDEEFF0011",
    "nonce_source": "override",
    "auth_ok": true,
    "plaintext_sha256": "018e24aa1fda0bdf28dc1b357978d4d6dde5fea4136204ed801be775429e8b8b",
    "reason_code": "authenticated"
  },
  {
    "frame_id": "frm-018",
    "label": "sierra-channel",
    "gif_index": 18,
    "key_version": 2,
    "key_source": "latest_assigned",
    "nonce_hex": "05D4E5E555568CD019B3F71F",
    "nonce_source": "derived",
    "auth_ok": true,
    "plaintext_sha256": "28cbee7590949aea2e1385c3a3bd760a75db989d8f05c8b81230f6b8c7175c87",
    "reason_code": "authenticated"
  },
  {
    "frame_id": "frm-019",
    "label": "tango-channel",
    "gif_index": 19,
    "key_version": 3,
    "key_source": "rotation_replacement",
    "nonce_hex": "44ADD7F6E9FF832A5DC3A97F",
    "nonce_source": "derived",
    "auth_ok": true,
    "plaintext_sha256": "a8433c2a9062c5d0bc81f86db6f08d181e169ab21590937e48d13d4a09cc82fd",
    "reason_code": "authenticated"
  },
  {
    "frame_id": "frm-020",
    "label": "uniform-channel",
    "gif_index": 20,
    "key_version": 2,
    "key_source": "latest_assigned",
    "nonce_hex": "D4E5F60718293A4B5C6D7E8F",
    "nonce_source": "override",
    "auth_ok": true,
    "plaintext_sha256": "b4ec09d39889f04f81f94d1f361af65a7e2ec0c8b5558c11336539556e54da85",
    "reason_code": "authenticated"
  },
  {
    "frame_id": "frm-021",
    "label": "victor-channel",
    "gif_index": 21,
    "key_version": 2,
    "key_source": "latest_assigned",
    "nonce_hex": "22B02A4266109B2F78C5E44F",
    "nonce_source": "derived",
    "auth_ok": true,
    "plaintext_sha256": "5694d5beb35ecde36c90540e09bc4a281aed3caea03d7c8a7713d689d063a0e4",
    "reason_code": "authenticated"
  },
  {
    "frame_id": "frm-022",
    "label": "whiskey-channel",
    "gif_index": 22,
    "key_version": 4,
    "key_source": "rotation_replacement",
    "nonce_hex": "E1F2A3B4C5D67890ABCDEF01",
    "nonce_source": "override",
    "auth_ok": true,
    "plaintext_sha256": "153b19596319ca0312b47851616c3adddda7555b19615967f23233497a5add19",
    "reason_code": "authenticated"
  },
  {
    "frame_id": "frm-023",
    "label": "xray-channel",
    "gif_index": 23,
    "key_version": 2,
    "key_source": "latest_assigned",
    "nonce_hex": "3C4D5E6F708192A3B4C5D6E7",
    "nonce_source": "override",
    "auth_ok": true,
    "plaintext_sha256": "907774b76d73ef41c6995fb2fdaa2c4f41215594437341966631eef4dcd9e7e0",
    "reason_code": "authenticated"
  },
  {
    "frame_id": "frm-024",
    "label": "yankee-channel",
    "gif_index": 24,
    "key_version": 5,
    "key_source": "rotation_replacement",
    "nonce_hex": "708192A3B4C5D6E7F8091A2B",
    "nonce_source": "override",
    "auth_ok": true,
    "plaintext_sha256": "bc0bb2099ff8b1dc81f464a7bb42d43e61e4cadf1d3a4f99b585edbd0da2aaef",
    "reason_code": "authenticated"
  }
]
